airline_name,author,date,content,type_traveller,cabin_flown,overall_rating,seat_comfort_rating,cabin_staff_rating,food_beverages_rating,inflight_entertainment_rating,ground_service_rating,value_money_rating,recommended
hk express,P Staniere,2017-08-24,"✅ Verified Review |  Hong Kong to Tokyo Narita. Unfortunately, typhoon HATO and my flight was cancelled. I got an email 14h before departures announcing the cancellation of the flight. 3 options were proposed:  Same destination in the next 3 days with possibly no fare difference applied, Other destination in the next 7 days, fare difference to my charge or Full reimbursement. But no indication on how to do the changes except to email them or use the chat for more informations. The search engine, the chat and the phone line were down during most of the day. The community manager answered me on Facebook 22h after my first contact.  I had my first successful contact on the phone with HK express 20h later. And everything was already booked. The customer service did nothing to provide a solution.  In the end I had to book through another airline, for 5 times the original price 3 days later.",Couple Leisure,Economy Class,1,,,,,,1,no
hk express,L Cheung,2017-08-12,"✅ Verified Review |  Flew HK Express from Hong Kong to Chiang Mai. There are occasional delays on this route of up to 4 hours, yet I was fortunate enough to board a punctual flight. The seat is spacious compared to my expectations, while the service of the cabin crew was also good. The flight went through few slight turbulence and the flight purser made announcements every time. The price was reasonable as I bought it in the sales. Online check in is clear and convenient as well.",Solo Leisure,Economy Class,10,5,5,,4,5,5,yes
hk express,W Han,2017-08-11,✅ Verified Review |  Hong Kong to Phuket return.  Both outbound flights were re-timed about 3 weeks prior to departure. That's okay. My returning flight was delayed from 0135 to 1020 due to weather. They did send email 3 hours prior to flight time to inform. So such delay (more than 8 hours) can be claimed for travel insurance so I asked for written proof via email afterward. The customer service gave me the proof for re-time but not the delay. After a few email chase they still could not produce a correct one. I am disappointed.,Solo Leisure,Economy Class,4,3,3,,,3,3,no
hk express,S Kim,2017-08-03,"✅ Verified Review |  Hong Kong to Jeju. Incompetent and irresponsible. Considering it's low cost flight, I wouldn't bother complaining other things (uncomfortable seats, food etc), but when there was a 6 hour overnight delay, the staff were handing out cheap restaurant vouchers. When I complained about the delay with no appropriate compensation, they emailed me the voucher that could be only used with HKD payment upon next purchase. I then found out there was no way to book with HKD payment on their website, so emailed about it again. Basically they have been emailing me once a week saying ""We will forward your email to the relevant department"", so I got sick of it, went on to have a chat with a customer service, and then got another ""Please send your email and I will forward your email"". This is a frustrating nightmare in an infinite loop, and they have no interest in helping you.",Solo Leisure,Economy Class,2,,,,,1,1,no
hk express,Bowen Ho,2017-04-30,"✅ Verified Review |  Flew from Hong Kong to Nagoya, Japan for holiday, during winter times in January. The service was excellent. There were no delay what-so-ever. Although I did not pay to choose the seats. But I asked the staff at the check-in counter if I could have a aisle seat, and I did! The flight took off on time and landed on time as well. I did not order any food on the flight because it is a short haul flight - 3hr flight. I would definitely refer to everyone to take this airline.",Solo Leisure,Economy Class,8,4,4,,,4,5,yes
hk express,Gary Macdougall,2017-01-19,"✅ Verified Review | Nha Trang to Hong Kong with HK Express. Low class and basic service. The airline mucked up my online seat reservations for my wife, I and 3 year old son. I had to pay an extra US$30 at the airport to sit with my family. Staff at the airport not helpful at all. The airline kept changing the flight times which is a bit of a nuisance. I booked seats in row 1 thinking we would be off first. Forget it. Although we were in row 1 our bags were placed in lockers up to 4 rows back and staff didn't let us retrieve those before the mob stampeded towards the exit. It was chaos and traumatic as I got shoved all over the place trying to retrieve my baggage,. Nightmare. HK Express staff just shrugged their shoulders. Food is disgusting not fit for pigs. Nicely packaged but it's rubbish. Seats extremely small and uncomfortable.",Family Leisure,Economy Class,2,1,1,1,,1,2,no
hk express,C Tan,2017-01-06,"✅ Verified Review |  Danang to Hong Kong. Very inefficient and slow check in process with apathetic ground staff. As expected, boarding was a mess. Once on board, cabin crew were young but do not look welcoming. Seats were typical low cost carrier seat. Pre-ordered a baked pork chop rice and the portion was pathetic, served lukewarm. When this was made known to the crew when she was passing with the trolley to sell drinks, she snatched the box without an acknowledgement. Thinking that she would reheat it, she moved on with her trolley and did not come back for another 20 mins and put the box on the table without a word. Flight was 30 minutes late leaving and 30 minutes late arriving at the remote terminal in Hong Kong. Despite a long train ride back to the main terminal, bags took a further 40 minutes to reach the carousel. This is certainly a one time experience never to repeat again. The cost of the ticket was not low either.",Couple Leisure,Economy Class,1,2,1,1,,1,1,no
hk express,Roy Gilham,2016-10-14,"✅ Verified Review |  Kunming to Tokyo Narita via Hong Kong. I have flown with this airline five times; every time the flight has been delayed by at least 30 minutes, usually one hour. This time our flight was cancelled due to plane malfunction. Staff kept us on the plane for five hours. Aircon wasn't working so the plane was hot and uncomfortable, but we were not allowed to leave. Staff refused to give us water, saying we had to order drinks from their onboard menu. Once we were finally off the plane, staff refused to give passengers their luggage, or confirm that we would be flying that day, only saying that we would have an update sometime after 3pm (flight originally scheduled for 7:30am). I missed my connecting flight in HKG (also with HK express), yet they refused to put me on the evening flight to Tokyo, even though there were spare seats, because their evening flight was flying into a different airport. Finally, we left Kunming at 5pm, arrived in HKG around 10 hours late and had to wait until the following morning for a connecting flight. Staff refused to refund anything, give food or water or pay supplement for hotel.  Point taken; this is last time I will fly HK Express.",Solo Leisure,Economy Class,1,2,2,1,,1,3,no
hk express,S Ramsey,2016-08-23,"✅ Verified Review |  Siem Reap to Incheon via Hong Kong. HK Express did not handle a bad situation well, it was major delays due to a typhoon. I was flying from Siem Reap to Incheon, with a 5 hour layover in Hong Kong. Unfortunately, there was a typhoon in Hong Kong. Everything was delayed, not the the airlines fault. However, their handling of the situation was the worst I could imagine. Passengers were sent an email at 4am to let them know there would be a delay and the flight would leave at 3:40pm, however I did not know until after arriving at the airport. HK Express representatives were not at the airport in the morning and the airport did not know of the delay. We were checked in by other staff. Representatives arrived to the airport and arrived to our gate around noon. They handed out meal vouchers, but didn't discuss the flight with passengers. When I asked to rebook my flight from Hong Kong to Korea, they told me that it was probably already done. The meal the company gave for those of us waiting was incomplete. And with further delays, the flight did not leave until 8:50pm. In Hong Kong I was met by staff off the plane and taken to a place where I could rebook my flight. This was with the help of cabin service staff, who were the redeeming quality of the trip despite having no ability to solve any of the problems. The booking had not been made. I was told that if I wanted a flight before 5:15pm the next day (it was about midnight), I would have to call the company. While waiting on the phone, I was pushed to accept the night flight. Finally, I did so after no one answered the phone. Before booking, the airline staff member left me in the airport. He said two women at the counter would come get me after everything was complete. After three hours I went to the counter as they had not talked to me. They informed me that, although the booking was not complete it was better for me to leave the airport and come back later. I refused without flight confirmation and they called the airline. Apparently the booking had been completed and they were simply unaware. There was no compensation for hotels or meals. The 5:15 flight was delayed until after 8:00pm. These were rolling delays which were continually pushed back. The staff in both Hong Kong and Siem Reap were rude and refused to answer questions. I was repeatedly told to wait and no answer came until I demanded one. Understandably, the airline can do nothing about the major holdups at the airport due to the typhoon, however their policies to deal with these emergencies was poor.",Solo Leisure,Economy Class,1,2,2,1,,1,2,no
hk express,C Long,2016-05-05,"✅ Verified Review |  I had my first trip on this LCC from Hong Kong to Tokyo Narita, and was generally happy with the experience. No online check in so we lined up to check in baggage but that was expected. The flight itself was OK, I had hoped they would dim the lights for longer given there was nothing to do but sleep. The return journey is where the drama occurred, and the airline couldn't have handled it worse. Flight was scheduled to depart at 19.30, there were strong winds at NRT that day, and when I arrived at the counter at around 17.00, they were not checking passengers in and the airport was making announcements that flights were halted due to strong winds. Without going into too much detail, at around 19.00, from flightradar24, I found that the inbound aircraft of my flight landed, only to be kept waiting at the counter, with ground staff telling us due to weather conditions the plane could not land etc. Some time later it was apparent that this aircraft was used for the earlier 16.20 flight. We were only told at after 20.30 that our flight was delayed until 09.30 the next day due to weather. The airline handed out 1000yen cash, sleeping bag, and an offer that if we booked a hotel, the airline would reimburse max USD100. They knew there would be no aircraft for us, yet they kept us waiting. They just kept saying it was weather. All other flights departed that night. The flight eventually was further delayed and took off at after 10.30, without telling us about the additional 1 hour delay. I had a glimpse of hope that in spite of the delay, we might get a free snack or a free drink on board? I was starving. However no, we were told outside food was not allowed and we needed to buy food. Arriving in HKG, ground staff handed out delay certificates but when passengers asked about compensation or anything else, they declared they were simply the agent, they were not HK Express staff. I have not received a single word of feedback.

",Couple Leisure,Economy Class,1,3,3,,,2,1,no
hk express,Peter Lai,2016-04-10,"✅ Verified Review |  Flight from Hong Kong was delayed from 5 till 9pm, which mean I arrived in Seoul at 12midnight. This meant no trains, so I had to take a expensive taxi to town. No compensation. The return flight was also bit delayed, airline seems lax on punctuality.",Solo Leisure,Economy Class,2,1,2,,,1,2,no
hk express,Janet Ong,2016-02-06,"I was supposed to take the 6.55am flight from Hong Kong to Seoul. Arrived at the airport at 5.45am, but was told at the check in to leave behind a telephone number and to come back in 5min. 5mins later the lady at the check in told me that the flight was overbooked and that she would need to reschedule me at the 5pm flight. As such I would miss a full day of my trip. Only explanation given was that the plane changed to a smaller one. Compensation was HKD1645, which far from compensates for the time lost.",Couple Leisure,Economy Class,1,,,,,1,1,no
hk express,Aeron Aquino ,2016-02-05,"Check in at Tokyo Narita was efficient with HK Express. There was a delay in the flight, hence, we arrived in Hong Kong late. The seating was on a 3-3 configuration. Like any other low cost carrier, it looked and felt cramped, but, the pitch was acceptable. The meals were okay. The cabin crew looked tired but they tried their best to look after us. There were turbulences along the way but nothing major. Overall, HK Express is okay, nothing bad, nothing great.",Solo Leisure,Economy Class,5,3,3,2,,3,3,yes
hk express,Francis Wong,2015-11-29,"My experience with HK Express was great. I purchased a very cheap ticket and added hot seat plus hot meal. I was entitled to use their priority check in which was a godsend. Check in took a few minutes with no fuss. Onboard service was on par with any regular airlines. The seating is 3x3 with acceptable seat pitch. No entertainment so bring your own. Food was served immediately after take off. My pre ordered hot meal was delivered with a smile plus a free bottle of water. The quantity is small, but the taste was actually quite good. The pilot was from Australia and the high standard and safety is very reassuring. 2:40 hours passed by quickly and we landed in Chiang Mai perfectly on time.",Solo Leisure,Economy Class,8,3,4,4,,4,5,yes
hk express,C Chan,2015-05-27,I took the flight from Hong Kong to Chiang Mai which was supposed to depart at 17.05. However no boarding announcement was made at all and by 17.30 the land crew told us that the flight might depart late and asked us to return by 18.15. Passengers left the queue and returned as told and at approximately 7pm they told us to wait until 19.30. Eventually at 20.30 they told us to wait for another announcement which would tell us whether we could fly or not. There was no offer of water or biscuits or any sort of remedial gestures at all. Finally at 9pm we were told that the flight was ready and we were sent to the plane. We had to wait for another 90 minutes onboard before we could take off. Plane left Hong Kong International Airport at 11pm. Unfortunately that was not the end of the story. The flight attendants sold food and drinks on the plane. As we were all very tired and hungry passengers almost all of us had to buy food from them. My friend and I sat in the middle of the plane and when the trolley passed by us and we just humbly wanted to buy 2 cup noodles the flight attendants said they were out of stock! One point to note is that both the land crew and the cabin crew were very helpful.,,Economy Class,1,3,4,1,1,,1,no
hk express,L Chan,2015-05-18,The HK Express website is easy to use. My flight was from Hong Kong (HKG) to Osaka (KIX). The check-in process with my baggage was pretty straightforward and without problem. The flight was overall quite clean and it departed on time. There is no food/beverage/water everything needs to be bought if you want to eat/drink. But that's okay if it's a short flight. The returning flight was just as simple and easy. There was staff at KIX to help with the check-in and baggage. Flight was also on time overall a smooth and problem free process. The baggage came out pretty quickly on both my flights not too long of a wait. I would definitely recommend this airline for flights around Asia.,,Economy Class,9,4,4,1,1,,5,yes
hk express,M Galjor,2015-02-20,"I've done the HKG-HND round-trip on HK Express four times in the last 3 months. I always take UO622 dep HKG 7.10 to go to Japan and UO623 dep HND 1.10am coming back. I used to fly CX to HND but prices have really gone up over the past year. Overall I'd give 3 out of 5 stars for my experience. Prices are of course much cheaper than CX and I appreciate that. 2) Flight attendants are professional courteous and the service is good (not that there are many opportunities to get ""served"" since HKE doesn't offer complementary beverage/food service nor does it offer inflight entertainment). 3) The HKG-HND-HKG flights I've taken have always been on time. 4) Flight times are much more convenient than the CX flights. However 1) Seats are uncomfortable - it's an LCC after all! This doesn't really bother me for the inbound flight which is 3.5 hours but I do end up feeling exhausted after the outbound which is a 4.5 hour redeye. I find the ""sweet seats"" located in the exit aisles a really bad deal - you get the (slightly) extra leg room but your seat has zero recline. 2) Baggage fees: I've noticed that more recently they've started to enforce their baggage rules much more strictly. Hand baggage may not be more than 7.7kg. If you don't sign up for checked in baggage in advance (online when you buy your ticket) you will be charged an arm and a leg at the airport. This happened to me during my last trip and wouldn't have bothered me (rules are rules after all and these fees are part of the LCC business model) had it not taken 1 hour to receive my bags at Hong Kong airport. 3) Long wait for baggage - This last point is apparently an every day occurrence with HKE at least at Hong Kong airport. They are working with a small staff and small planes so your bags will routinely take an hour or so to arrive at Hong Kong airport baggage claim. This is needless to say frustrating though not the biggest deal in the case of UO623 since you have to kill an hour or so after the flight lands anyway (the first Airport Express to Hong Kong station doesn't leave until 5.54am and UO623 lands at around 4.40am). 4) No mileage programme. All in all I will still use Hong Kong Express but due to some of the negative points I listed above only if the price differential between CX and UO is significant enough to be worth it.",,Economy Class,7,,,,,,3,yes
hk express,Alexander Capousis,2015-02-06,3 flights in the last month (ICN-HKG HKG-CNX HKG-PUS). All arrived either on-time or early. Contract check-in staff at all airports but check in was quick and efficient. Staff were friendly and helpful. You'll likely be on a shuttle bus at some point if you're flying them at HKG. Would love it if they added a check-in lane for those without checked baggage. Expensive food and drink options on board so eat before you go. Pilots were informative and professional. Highly recommended for those on a budget!,,Economy Class,8,,,,,,5,yes
hk express,David Silverking,2014-08-14,"We recently flew HKG to Penang direct. The flight was on time leaving and was faultless on the 4 hr flight. The seats are fixed up right with no recline option on any seats. We bought the extra legroom option & were glad we did. Considering the tickets were half the same Dragon air flight and landed only 10 minutes apart this is a no brainer. ""I'll be back"".",,Economy Class,9,3,4,3,1,,5,yes
