airline_name,author,date,content,type_traveller,cabin_flown,overall_rating,seat_comfort_rating,cabin_staff_rating,food_beverages_rating,inflight_entertainment_rating,ground_service_rating,value_money_rating,recommended
hk express,S Murten,2020-03-03,"✅ Trip Verified |  Hong Kong to Siem Reap. We flew during widespread fear about coronavirus and the flight was underbooked: the plane was only about 1/5 full. Nonetheless, the crew insisted on squishing everyone together because this airline wants to charge extra to sit apart from one another, even when extra seats are available.  As we were about to land, the flight attendant blasted the cabin with some sort of aerosol spray, which I'm sure is totally going to make up for the fact that we were sitting next to someone who was coughing the entire time. Will not be flying with them again.",Couple Leisure,Economy Class,1,2,2,,,2,1,no
hk express,C Mejia,2020-02-18,"✅ Trip Verified |  Advertising looked enticing so I used HK Express from Hong Kong to Phuket Thailand for round trip. Seats were comfortable enough, buy on board was to be expected, and flight to Phuket was good. Coming was the nightmare. Was scheduled to leave at 11:50am the 14th of Feb 2020, but the flight got cancelled, okay I got the email about it on the 12th no big issue since I was checking out of my resort the 13th, I will just take 23:55 flight on the 13th - wrong, also cancelled. Numbers provided don't work people in Phuket airport info counter were trying to get a hold of someone to get the right number. Email response sent the 15th 3 days after the initial email was went - wow. Got to HK via Air Asia and asked for refund which the airline gave as option. Scanned some QR code got an email that the refund is being processed pending some criteria is met? they cancelled my flight enough said. I will be going to Thailand again soon and not with HK Express - avoid!",Solo Leisure,Economy Class,2,3,3,,,2,3,no
hk express,Chun Sing Poon,2020-01-27,"✅ Trip Verified |  Hong Kong to Osaka operated by A321. The sea is not comfortable and there is not headrest.  However, it is fine for budget airline and short haul flight. You need to pay for the food but it is acceptable because HK Express is a budget airline. Since the weather is bad, the plane suffered strong turbulence and became unstable. The plane suddenly decreased and many passengers felt panic.  The service from the crew is good, only thing that disappointed me is that the crew didn’t smile. The airline also sells the train ticket, this is definitely convenient.",Family Leisure,Economy Class,5,2,3,,1,3,3,yes
hk express,M Karjilit,2019-12-28,✅ Trip Verified |  Fukuoka to Hong Kong. I was not carrying my transfer permit document.  I managed to get the transfer permit document and showed it to the counter but they told to print it out and while I get the printout and it was just 5 mins late and they refused my boarding into flight.  They didn't tell me how to get the permit. I will not suggest this airline for anyone to avail of.,Solo Leisure,Economy Class,1,,,,,1,1,no
hk express,P James,2019-12-11,"✅ Trip Verified | Tokyo to Hong Kong. The plane landed safely and I would give them credit for that. The food I ordered was packaged in a cheap plastic container served as soon as we took off. I was expecting it to be dinner as the flight departs at 3 in the afternoon. Who orders a proper meal and eats at 3pm? I would say the majority would want their food to be served at dinner time. If I knew that I would have just brought a bento from the airport. Much better quality and cheaper. In addition to that, HK Express charged me HK$10 when I asked them to fill up my own bottle with water. No, despite the fact that I paid for U-first, a meal, and seat reservation. No they wanted $10 for tap water or else. It’s not that I really care about the money itself, but rather what if someone doesn’t have $ with them to pay for it, what if they don’t have a credit card with them while traveling (no, MasterCard debit doesn’t even work I tried. They take only credit)? Are you seriously just going to deprive of someone water that costs you next to nothing to give to them? For 5 or more hours? They know people can’t take water with them onto international flights unless you buy it after you get into the restricted area! Hence a lot of people don’t carry water with them. Luckily I had cash after their machine refused to take my travel debit. This is just pure corporate greedy over basic human necessities. I have never seen any airlines this greedy for money and would go to the extreme to charge people for tap water. Not bottled, tap! I wouldn’t be surprised if they started charging people to use toilet too. Look, if you are that greedy for money, at least price it into your tickets instead of charging people on the flight and slap them with a charge like this mid-flight alright? They are literally the worst airlines I have flown with. Yes that includes budget airlines. If you want cheap tickets, sure, just be prepared to bring everything with you including water. How are you going to get water through securities you ask? Well, you better figure out a way.",Solo Leisure,Economy Class,1,1,2,1,1,2,5,no
hk express,JJ Lim,2019-12-11,"✅ Trip Verified | For a budget carrier, HK express is just about the best you can get. Do not expect frills, but they use new planes with new seats which are ergonomically designed and offer a reasonable amount of comfort and legroom while still being able to maximize revenue for the airline. I have flown several other routes other than this, namely HKG-FUK, HKG-CNX, HKG-BKK and HKG-HND and their service standards are consistently decent too. The cabin crew, despite representing a budget carrier, maintain the best of professional standards and carry the corporate image very well. HK Express boasts of a very extensive flight route network to various parts of Japan and that is another of their biggest competitive advantages. That said, their network around the rest of Asia is very respectable too.",Couple Leisure,Economy Class,8,4,5,,,4,4,yes
hk express,S Wong,2019-11-19,"Not Verified |  Osaka to Hong Kong. Because my airline messed up my flight I had to buy a last minute ticket and went with HK Express. Well, in terms of service, it was fantastic. I didn't have to wait in line so I can't comment but what airline doesn't have lines ups. The flight departed on time and I did not encounter delayed/lost baggage. At the same time my niece was flying HK Express in another city and it went smooth in every aspect. I wouldn't hesitate to fly them again. For flights longer than an hour it would be nice if they could service a beverage and the option to order food.",Solo Leisure,Economy Class,8,4,3,,,5,4,yes
hk express,Suzanne Walmsley,2019-10-22,✅ Trip Verified |  In June 2019 my husband and I flew from Angkor Wat International Airport to Hong Kong with the carrier Hong Kong Express - Flight UO707. It was supposed to leave at 17.55 but we were nearly 2 hours late departing due to the plane not arriving in time because of bad weather in Hong Kong. When we finally arrived in Hong Kong close to mid night we found that my suitcase on the carousel had been tampered with but as I couldn't think at the time of anything that had been stolen apart from a grey baseball cap I did not report it. I notice that the zip was partly undone and the outer luggage strap was loosely tied on to the handle only. On checking the contents when I got to our hotel I notice that my wallet which was hidden originally at the bottom was now on top and open and the middle compartment also unzipped. As I had taken all my credit cards out previously I only had library cards and shop loyalty cards in it and they had not been touched. Also the coins in the side compartment had not been taken even though that zip was undone too. However a week later on remembering that I had put my wedding rings in the middle zipe of my wallet due to my fingers swelling in the head I immediately contacted the airline but to now avail and I am unsure now how to proceed with no communication forthcoming apart from one that said the CCTV footage revealed nothing. I have informed them that I am aware that 6 baggage handlers were arrested recently for theft but have not received a reply. I am deeply upset at my insurance declined to reimburse me as goods of value should have been with my carry on luggage.,Couple Leisure,Economy Class,1,3,3,,,1,1,no
hk express,P Robertson,2019-10-12,"✅ Trip Verified | Hong Kong to Osaka. Shocking experience just does not feel like an airline who concerns about the safety of its customers. We were due to fly to Osaka for a weekend trip on the 11th of October 2019, due to a super typhoon due to hit our destination on the 12th of October we feared for our personal safety and not being able to return home on the 13th of October. Hong Kong Express refused to assist us with re-booking our flight, we even stated we where happy with applicable fees and fare differences. There where already travel warnings in effect from numerous governments and other airlines were already offering free changes of flights irrespective of ticket class.",Couple Leisure,Economy Class,1,1,1,,,1,1,no
hk express,Jason Tsang,2019-09-26,"✅ Trip Verified |  
There are a number of airlines that fly the Hong Kong to Seoul route, but HK Express were the cheapest and had a website that was user friendly. The flight was prompt and efficient. The staff were pleasant and professional. The experience was as good as Cathay Pacific, but without food, drink and entertainment. I really can't fault them. The HK Express staff at Seoul were excellent. I manage to forget that the WiFi egg I hired was in the checked baggage. They helped me by taking the bag out and allow me to retrieve the item. Which they returned on my behalf. Very nice and gone out of their way to assist. I will definitely fly with HK Express again.",Solo Leisure,Economy Class,10,5,5,5,,5,5,yes
hk express,H Kan,2019-08-03,✅ Trip Verified |  Kansai to Hong Kong. The flight is just below average. The flight delayed for about 40 minutes as they said that Kansai airport is busy and the weather in HK is bad. They said we can get in the A321 at 1715 but they only open the gate at around 1730. We ordered two boxes of food which one of them is a Thai beef. The food size is a bit smaller than I thought and the taste is bad but it cost a lot of money (HKD65).The flight policy of not allow to use phones during take off and landing is silly.,Family Leisure,Economy Class,4,2,1,2,,2,3,no
hk express,T Haulger,2019-07-22,"✅ Trip Verified |  Everything went smoothly, no very long lines anywhere. We checked in on net, got seats together, no problems at baggage drop, started boarding half an hour before schedule, took off 20 minutes after schedule, landed on time. This was like a trip should be and we are satisfied with HK Express.",Couple Leisure,Economy Class,9,4,5,,,5,5,yes
hk express,Susan King,2019-07-12,Not Verified |  We flew yesterday and we were absolutely disgusted with the service! Because of a fault in the plane we had to transfer to another aircraft. During which time our bags had to be transferred also. when we finally reached out destination we found that our bags had obviously left put in the rain! Our clothes etc were all very damp! The staff was not helpful at all and didn't communicate the situation very well. Not very satisfactory especially for those with small children. Would not recommend this airline in the future,Couple Leisure,Economy Class,2,1,1,,,2,3,no
hk express,Kristen Delugar,2019-05-23,"✅ Trip Verified |  Tokyo Haneda to Da nang via Hong Kong. I was highly impressed with this airline. After reading the reviews I was concerned, but I had an amazing service! I paid a few dollars extra for their U First service. We got a priority line, and got to board first. Flight was on time and check in counter staff friendly. I had pre ordered food. They asked me when I would like it to be served. The food was delicious (Satay with rice). Everything on next flight ran smoothly. Online check in was great.",Family Leisure,Economy Class,10,5,5,5,,5,5,yes
hk express,B Quinn,2018-12-07,"✅ Trip Verified | Hong Kong to Tokyo. First, when you book on internet, of course the price is attractive and you are directly interested by it. Then, comes the reality : You have to pay for your seat (50 HKD per seat) • You have to pay for the luggage (344 HKD for 25kg) You can pay during the online check-in. However, if you do not pay during the online check-in, the price at the airport counter is the double! My phone had a problem in Japan and I could not made the online check-in. I made a screenshot of the situation (Trying to make it but impossible, with the hour) and I showed it to the counter, to prove that I tried but that there was a problem. They did not care about it and answered : It is not our problem, we can not do anything. Even if they saw that I tried to do it! What is this customer service? Moreover, as it is a low-cost company, their counters are always very far away, and you have to wait long time before to have your flight. Your flight is supposed to be at 8pm? You will take off at 8:30. Then, as the customer service is terrible at the counter, he has to be the same in the plane : Very strange policy about the electronic devices that we can not use during all the take off (and as I told before, it is a long time) and during the landing. First time that it happens to me. To conclude, I paid an extra charge of 590HKD for my luggage to go and to come back so 1180 HKD, plus the seats, I lost many times walking through the airport, waiting at the boarding gates or in the plane. If you do the assessment, at the end, it cost you more money and more time than a good company! Last word : Shame on this company who do not care about customer service and they lost one guest (one more in fact, as I can see on the other reviews that I am not alone in this situation)",Couple Leisure,Economy Class,1,1,1,1,1,1,1,no
hk express,S Teale,2018-10-13,"✅ Trip Verified |  Hong Kong to Tokyo. HK Express was pretty standard. The prices for the drinks were not too bad, all things considered. I had to write a review about the staff, however, who were exceptionally friendly. I left a book on the plane and they very kindly helped me retrieve it with a very polite and friendly manner. They were very friendly and helpful about the matter by keeping me updated on where the book might be, and went the extra mile to make sure I had my belongings returned within an hour! On the way back the air steward was also very kind, and thoroughly explained the exchange rate for JPY to HKD when we bought items from the food cart. Overall I am so impressed by the staff!",Solo Leisure,Economy Class,6,3,5,3,1,4,3,yes
hk express,Jennifer Wang,2018-10-08,"✅ Trip Verified |  Tokyo to Hong Kong. They charged expensively on checked in luggage, so watch out for your luggage weight. Flight was delayed for over 40 mins. No inflight entertainment for 5 hour flight, pretty painful. Bags were delayed for unknown reasons. Baggage claim was really far (at the very end of all). Overall an awful experience.",Couple Leisure,Economy Class,1,1,2,1,1,1,2,no
hk express,G Arnadottir,2018-09-18,"✅ Trip Verified |  Jeju to Hong Kong. They charged me for a 20 kg checked in luggage because I have 10kg hand luggage instead of 7kg. If they want to charge for that, they should charge an excess charge per kilo, not make me pay for extra 10kg. I will not pay another ticket with them because of this, and losing customers like this is very bad in the long term.  Also, they have this ridiculous policy that you cannot use any electronic device (including your mobile on airplane mode) as soon as they start descending, which other airlines have no issue with.",Solo Leisure,Economy Class,1,1,,,,1,1,no
hk express,N Chee,2018-08-28,"✅ Trip Verified |  Hong Kong to Busan. Heard the horror stories about HK Express, but my experience overall during a few flights in the past year was fairly uneventful except for frequent changes in flight schedules (all minor). This flight was no exception. No frills but everything worked, and we got the tickets for a good price.",Family Leisure,Economy Class,8,3,4,,,4,5,yes
hk express,G  Caranez,2018-08-24,"✅ Trip Verified |  Four months ago, I booked a flight from Hong Kong to Incheon. The online site stated 9:00 pm, I specifically checked for the 'pm' as I thought it is odd that they are not stating the flight time as 22:00. I then booked the flight 25 April 2018 and was sent the confirmation details as 9:00 am. I called the center right away and the ticket was said to be canceled with a full reimbursement within 8 weeks from cancellation. After over 8 weeks, I received less than half of the flight reimbursement fee. I kept in contact by email throughout the time to make sure that I get a full reimbursement as I was told due to the online bookings time which was incorrect. I am very disappointed as this was not good. My last email from the airline stated that I agreed to a tax refund only.",Solo Leisure,Economy Class,1,,,,,,1,no
hk express,P Meares,2018-08-23,"✅ Trip Verified | Firstly when checking in - they said we had emergency row seats on both flights. We had exit seats on the first flight but turned out we had regular seats on the second. We noticed when we entered the aircraft. First flight: 30 minute delay, second flight 50 minutes delay. No apologies by the crew. They lost my suitcase and I spent 45 minutes filling out all kinds of forms in Tokyo which caused me to miss the last bus from the airport. Because of that I had to take an expensive taxi. ",Couple Leisure,Economy Class,2,2,2,,,1,1,no
hk express,Francis Wong,2018-05-28,"✅ Trip Verified |  HK Express is a low cost airline that has daily flights to various destinations in Japan. I have selected to fly to Osaka with them. To ensure maximum comfort (but still very affordable), I've opted for U-Biz, which includes 30 kg luggage, priority check in lane, luggage handling and boarding. There was discount offered for meals on board too. There was a rather long queue for normal check in, I was so glad that I bought U-Biz, which only took me a few minutes to queue and be checked in. For both the outbound and in bound flights, they were on time, all things promised were delivered. I was seated in the sweet seat which was the front row of 3x3. 4 cabin crew worked hard during the flight, and it was very smooth and uneventful all the way. Food was so-so but still ok. In Osaka, my luggage were amongst the first to come out. Return flight was more or less the same. Overall, I was very impressed by them, It really offered great value for money for going to Japan. I will not hesitate to fly with them again.",Couple Leisure,Business Class,8,3,4,3,,4,5,yes
hk express,D Hardie,2018-05-06,"✅ Trip Verified |  Hiroshima to Hong Kong. Smooth bag drop and boarding at HIJ. Uneventful and punctual flight out. Time of return flight was changed ""for operational reasons"" to 09:45, meaning I had to get up at 04:30 to travel to Hong Kong airport from my hotel in Macau. Macau ferry terminal upstream check-in service was excellent but the flight time change meant serious changes to my morning plan. Unacceptable for this change to be made - ticket was booked in June last year, change advised this year. Were it not for this change I would give them 10/10 as a budget airline. Good selection of seats available for a standard charge, as far forward as row 6.",Couple Leisure,Economy Class,3,4,2,,,3,5,no
hk express,R Lam,2018-04-19,"✅ Trip Verified |  Seoul to Hong Kong. The flight attendant yells at passenger if you don't allow device on 'airplane mode' whatsoever; for camera use or listening to music. Your flight attendant needs to explain in detail and give a guidance in a courteous way. Some crew had friends moved to the very front seat in U biz section beside us and constantly going back and forth between the seat and galley and chatted throughout the flight. Their friends were served the hot drinks first before the attendant start serving anyone else. The crew skipped us when serving drinks and snacks and we had to wait until they came back from serving all others to the end of the craft. One of our pre-ordered foods came out well after we finished eating the other. At least they apologized for the delay but the food wasnt even even warm, nearly cold. I bought U first and our seats were the very front bulkhead seats. ",Family Leisure,Premium Economy,1,1,1,1,,1,1,no
hk express,G Steade,2018-02-14,"✅ Trip Verified |  Hong Kong to Nah Trang. U First service on HK Express is worthless if you board at a bus gate And as they refuse to refund, exchange, transfer, or compensate you - it is a bit of a lucky dip whether purchasing U first is worth it at all. Just another cash grab by a budget airline.",Couple Leisure,Economy Class,1,1,2,1,1,2,1,no
hk express,P Raniwaya,2018-02-02,"✅ Trip Verified |  Hong Kong to Fukuoka. Book online and there was payment error with 1 card, so paid with another card. Later found I was actually charged at both cards and end up with duplicate bookings. Complained and they hardly get back to me beyond generic replies. It's best to call them. After persistent calls, they finally informed me that I'll get a refund. However it will take 6-8 weeks. I feel this is unscrupulous. Who knows what they do with the extra money charged from clients before refunding them 1 month + later?",Family Leisure,Economy Class,1,2,2,,,2,2,no
hk express,L Rease,2018-01-15,"✅ Trip Verified | Hong Kong to Kansai. When my payment appeared not to have gone through and I received no acknowledgement of my booking, I asked HKE if I should rebook. They told me I should but, after booking again (at a higher cost) I discovered they had already taken the money for the first flight. They accepted that they had failed to confirm the first flight and agreed to refund the money but it took a great many emails and involved a huge amount of time. I even had to battle with them over the insurance I had taken; even though I paid them for it, they tried to claim they couldn't refund it because it was paid on to another company. They also seemed to think it reasonable to refund less than was taken because the exchange rate was different. Any reputable airline would have refunded the higher amount I paid for the second tickets and sent a proper apology for all the anxiety caused and time wasted. There is no complaints procedure. If you ask them via ""chat"" how to complain, they send you the email address of Customer Services about whom I wished to make the complaint. The general impression I got was that they will try as hard as they can to not refund you and will only do so if you are extremely tenacious and decide that it is worth spending the time pursuing them for the principle of the matter. Nothing on earth would induce me to use HKE again. It may be fine when everything goes according to plan but, if something goes wrong and you need to seek redress, prepare yourself for a very, very long ride.",Couple Leisure,Economy Class,2,,,,,,1,no
hk express,H Bareed,2017-12-17,✅ Trip Verified |  Phuket to Hong Kong. The seats were comfortable for a 3 hour flight but aircraft was cold and toilets dirty. No blankets available for the amount of money I paid. Crew was very unhelpful and unfriendly compared to Thai Air Asia staff. ,Business,Economy Class,2,3,1,,,3,2,no
hk express,M Thorn,2017-10-16,"✅ Verified Review |  Siem Reap to Hong Kong. The online registering of baggage would not work for me for some reason, and I believe despite what the site says you will be charged $6 whether or not you select a seat. I did not select one and was charged, my friend selected one but was assigned a new one at check-in.  I was told by customer service they would make sure I paid the online price at check-in because the site was not working. At check-in the manager refused to help. My baggage was refused. I ended up putting it inside of my friends who was suppose to have the same deal as promised by customer service. He instead had to pay twice the online price. ",Solo Leisure,Economy Class,1,4,5,5,4,1,1,no
hk express,C Han,2017-09-04,"✅ Verified Review |  Nagoya to Hong Kong. I bought this ticket with a low price during the mega sale. The flight I took was delayed by about 1 hour due to the late arrival, yet the flight managed to land on Hong Kong with 30-minute delay provided that the weather in Hong Kong was bad. The cabin crews are kind and friendly. The seat is comfortable in terms of LCC. The inflight magazine also provides much information about the tourist spots.",Family Leisure,Economy Class,10,5,5,,5,5,5,yes
hk express,C Lam,2017-09-04,"✅ Verified Review |  Hong Kong to Jeju. This is a red-eye flight and I slept for nearly the whole flight. The seat is comfortable enough to sleep and the lights are turned dimmer. The flight arrived earlier than the scheduled time. The staff are friendly and kind. However, the food and beverages are quite costly so I didn't try. The online-check in is smooth and user-friendly.",Family Leisure,Economy Class,10,5,5,,5,5,3,yes
